超级纸片马里奥.wbfs,chao ji zhi pian ma li ao.wbfs
大地探索者.wbfs,da di tan suo zhe.wbfs
风之克罗诺亚 幻影之门.wbfs,feng zhi ke luo nuo ya huan ying zhi men.wbfs
火焰纹章 苍炎轨迹.gcz,huo yan wen zhang cang yan gui ji.gcz
火焰纹章 晓之女神.iso,huo yan wen zhang xiao zhi nv shen.iso
零-月蚀的假面.wbfs,ling - yue shi de jia mian.wbfs
零-真红之蝶.wbfs,ling - zhen hong zhi die.wbfs
胧村正 妖刀传.wbfs,long cun zheng yao dao chuan.wbfs
马里奥赛车wii.wbfs,ma li ao sai che wii.wbfs
塞尔达传说 时之笛.wad,sai er da chuan shuo shi zhi di.wad
塞尔达传说 天空之剑.wbfs,sai er da chuan shuo tian kong zhi jian.wbfs
生化危机2.iso,sheng hua wei ji 2.iso
生化危机3.iso,sheng hua wei ji 3.iso
生化危机 安布雷拉历代记.wbfs,sheng hua wei ji an bu lei la li dai ji.wbfs
生化危机 暗黑编年史.wbfs,sheng hua wei ji an hei bian nian shi.wbfs
瓦里奥大陆 摇晃.wbfs,wa li ao da lu yao huang.wbfs
星之卡比 重返.wbfs,xing zhi ka bi chong fan.wbfs
异度之刃.wbfs,yi du zhi ren.wbfs
异色代码 R 记忆之门.wbfs,yi se dai ma R ji yi zhi men.wbfs
御姐玫瑰 革命.wbfs,yu jie mei gui ge ming.wbfs
