BC动物赛车.32x,BC dong wu sai che.32x
FIFA国际足球96.32x,FIFA guo ji zu qiu 96.32x
NBA嘉年华锦标赛.32x,NBA jia nian hua jin biao sai.32x
VR赛车豪华版.32x,VR sai che hao hua ban.32x
VR战士.32x,VR zhan shi.32x
WWF疯狂摔角.32x,WWF feng kuang shuai jiao.32x
WWF世界摔跤比赛.32x,WWF shi jie shuai jiao bi sai.32x
暗影中队.32x,an ying zhong dui.32x
棒球俱乐部95.32x,bang qiu ju le bu 95.32x
冲破火网完全版.32x,chong po huo wang wan quan ban.32x
动物格斗.32x,dong wu ge dou.32x
蜂鸟.32x,feng niao.32x
橄榄球俱乐部.32x,gan lan qiu ju le bu.32x
高尔夫36.32x,gao er fu 36.32x
合金首领.32x,he jin shou ling.32x
黑色荆棘.32x,hei se jing ji.32x
毁灭战士.32x,hui mie zhan shi.32x
节拍小子.32x,jie pai xiao zi.32x
空间战机.32x,kong jian zhan ji.32x
恐龙佣兵.32x,kong long yong bing.32x
立体空战2000.32X,li ti kong zhan 2000.32X
玛雅冒险.32x,ma ya mao xian.32x
摩托车越野赛.32x,mo tuo che yue ye sai.32x
拳击争霸.32x,quan ji zheng ba.32x
三国志IV.32x,san guo zhi IV.32x
世界职业棒球95.32x,shi jie zhi ye bang qiu 95.32x
索尼克.32x,suo ni ke.32x
太空哈利.32x,tai kong ha li.32x
武装鹫狮.32x,wu zhuang jiu shi.32x
星际迷航.32x,xing ji mi hang.32x
星球大战.32x,xing qiu da zhan.32x
宇宙昆虫格斗.32x,yu zhou kun chong ge dou.32x
真人快打2.32x,zhen ren kuai da 2.32x
蜘蛛侠火网.32x,zhi zhu xia huo wang.32x
