霸王忍法贴/ninjamas.zip,ba wang ren fa tie
爆裂者复仇/breakers.zip,bao lie zhe fu chou
波奇和娜亚/pnyaa.zip,bo qi he na ya
得点王系列/neogeo.zip,de dian wang xi lie
敌后奇兵/shocktr2.zip,di hou qi bing
顶级猎手/tophuntr.zip,ding ji lie shou
饿狼传说系列/fatfury3.zip,e lang chuan shuo xi lie
番茄超人/neogeo.zip,fan qie chao ren
风云默示录系列/kizuna.zip,feng yun mo shi lu xi lie
豪血寺一族斗婚/matrim.zip,hao xue si yi zu dou hun
合金弹头系列/mslug4.zip,he jin dan tou xi lie
火热火热7/wakuwak7.zip,huo re huo re 7
街头篮球/strhoop.zip,jie tou lan qiu
龙吼双截龙 解密版/neogeo.zip,long hou shuang jie long jie mi ban
龙虎拳系列/aof2.zip,long hu quan xi lie
梦幻小妖精/twinspri.zip,meng huan xiao yao jing
泡泡龙/pbobbl2n.zip,pao pao long
碰碰球/bangbead.zip,peng peng qiu
拳皇VS街霸：乱舞千年加强版/svc.zip,quan huang VS jie ba ： luan wu qian nian jia qiang ban
拳皇系列/kof2k4se.zip,quan huang xi lie
热血快打/burningf.zip,re xue kuai da
忍者指令/ncommand.zip,ren zhe zhi ling
s1945p/neogeo.zip,s1945p
闪亮之星/blazstar.zip,shan liang zhi xing
侍魂系列/samsho.zip,shi hun xi lie
双截龙格斗/neogeo.zip,shuang jie long ge dou
天外魔境真传/kabukikl.zip,tian wai mo jing zhen chuan
痛快进行曲/aodk.zip,tong kuai jin xing qu
外星游龙/neogeo.zip,wai xing you long
武藏严流记/neogeo.zip,wu cang yan liu ji
午夜噩梦/neogeo.zip,wu ye e meng
原始岛二代/preisle2.zip,yuan shi dao er dai
月华剑士系列/lastblad.zip,yue hua jian shi xi lie
炸弹人/neobombe.zip,zha dan ren
战国传承3/neogeo.zip,zhan guo chuan cheng 3
终极任务-终极手段/lresort.zip,zhong ji ren wu - zhong ji shou duan
